restaurant,FOOD QUALITY,LOCATION,SERVICE,Topic 5,VALUE,avg_rating,review_count,FOOD QUALITY_text,LOCATION_text,SERVICE_text,Topic 5_text,VALUE_text
Sanoook,4.5292101875,3.0,4.4444337,3.0,4.8708916250000005,4.035714285714286,28,"Great Thai/Japanese fusion restaurant! Loved the twist on the menu. The food was delicious! Green chicken curry, Mieng Kam - translates to 'one bite wrap' combining all 4 flavours sweet, sour, salty & spicy - tantalising mouthful! Unagi Tofu steak wi...",No specific mentions found.,"The food here is awesome, and the ambience as well as staff service was excellent! Food is served pretty fast and staff always seemed to ensure we were enjoying our meal.",No specific mentions found.,"We tried this restaurant a couple of times, during our stay in Kuala Lumpur. We have been to Thailand many times & love Thai food! This is a Thai/Japanese restaurant, but predominantly Thai.We tend to like our food extra spicy & quite often stuggle t..."
Sanuki Udon,4.66087146,3.0,3.72620085,3.0,3.0,4.133333333333334,15,Sanuki Udon is a best place to eat udon noodles in a reasonable price. Their fried chicken is a must to try too.  The staffs are very friendly.,No specific mentions found.,"This is a basic, no frills restaurant. The udon is freshly made and is probably the best udon I've had. The menu is limited, but everything is good and it can get very crowded very quickly as it's a small place. The service is top notch. Highly recom...",No specific mentions found.,I've been here a few times throughout the years and I got to say the quality of food is still consistent. Totally worth visiting again.
Sarang Cookery,4.8330695225806455,3.0,4.146635455555556,3.0,4.8038094764705885,4.649122807017544,57,"We just walked in in this restaurant because we were staying close by. It was a very positive surprise! We had local dishes with beef and chicken. The taste was very good, not too spicy. I definitely recommend this place!",No specific mentions found.,"We had appetizers, entree and dessert and loved them. Each dish was delicious and unique. I recommend the Chicken Kapitan and the tapioca dessert was light, subtle and a great way to end a delicious meal. We went earlier in the evening as I think wor...",No specific mentions found.,Wonderful experience trying Nyonya food at this quiet and cozy restaurant away from the hustle and bustle of the nearby Bukit Bintang area. The food was delicious and it was just what I needed for a low key evening. I had a great conversation with on...
Saravana Bhavan,4.452077103846154,3.0,3.4035810666666664,3.0,4.372360123809524,4.0510948905109485,137,Great selection of very tasty indian vegetarian food. One of our favourite places and we visit regularly. So many good dishes that its difficult to single anyone out! Great value!,No specific mentions found.,Very courteous staff. Great menu. Authentic and great taste. Excellent ambience. My family thoroughly enjoyed the food.,No specific mentions found.,i had stayed in kl for three days and had my lunch everyday here.the quality of food is very good and keeps us feel that we are pretty much in india.the sevice is very good and being very close to kl sentral stassen it is worth to visit this restaura...
Saravanaa Bhavan,4.296022502803738,3.0,3.7721271888888888,3.0,3.945584258823529,3.9849624060150375,133,We were really excited by the wide selection of Indian cuisine dishes! The atmosphere of the place was also great. We definitely enjoyed our dinner here.,No specific mentions found.,The food was excellent and service was very good..my Malaysian friend and I had a great time eating at this restaurant. The blend of spices made sure the food is as authentic as food available in India. An ideal place for vegetarian food in Kuala Lum...,No specific mentions found.,We really enjoyed the food - wished we had found it earlier during our stay.  Good atmosphere and relatively cheap.
Sarvana Bhavan,4.152535036111111,3.0,4.860893175,3.0,4.7024548,4.1,50,My family came here for dinner as we were looking for a good Indian meal. This is the best South Indian food I’ve had outside of India. The curries were really delicious and the service was friendly.,No specific mentions found.,"This is a good food option, love the food at Saravana Bhavani across the globe. This also stands really well. They have amazing phulka and the best Indian tea possible in KL, My inlaws were vegetarians and they loved the food as well. Accommodating s...",No specific mentions found.,The Sarvana Bhavan located in Little India in KL is one of the best places to get authentic South India food in KL. The food was very delicious and better than many restaurants in India. We tried different dishes on different days and all the dishes ...
Satay Station,4.07816945,3.0,3.0,3.0,4.742015533333333,3.896551724137931,29,"We thoroughly enjoyed the satay at this restaurant, despite having eaten many delicious versions at stalls all around Malaysia we both agrees that this satay was among the best. The meat was very succulent and flavoursome, the peanut sauce was spicy ...",No specific mentions found.,"We love to meet up with friends here in this house restaurant that serves delicious Satay, Mee Rebus, Nasi Lemak & Rib Bone Soup. The house is so comfortable and suitable if you want to do a birthday celebration or school reunion. The chicken satay i...",No specific mentions found.,I have had satay approximately 10 times around KL and this place by far is the cleanest I have experienced. The grill is nice and the environment is very clean. They have a nice selection of non-alcoholic beverages for a hot day and their meat is ver...
Sausage Kl Cafe & Deli,4.87483908486842,4.900289327272727,4.9510501499999995,3.0,4.8808373410714285,4.9272030651340994,261,"Tried the spicy Italian sausage, streaky bacon and black pudding. It was super tasty and delicious. Both my husband and I loved it!! Can't wait to try more options from Sausage KL. Great Job providing good quality products. Found Sausage KL by coinci...",This was our second time here.Today we had bangers n mash + English brekkie. Bangers was sooooooo good! The sauce and mash was perfect! Friendly owner and nice service.Place was hidden inside the hotel but easy to get there. All the sausages are home...,Quality and taste is excellent. Sausages are probably the best we have tried in KL. Very happy and satisfied customer and will keep coming back for more. Keep it up!,No specific mentions found.,we recently discovered this hidden gem and were pleasantly surprised by the lovely taste and variety of not only the menu but the deli as well. Owner and staff were very smiley and pleasant. Its a must visit!!!
Savini Ristorante Italiano,4.059667683333333,3.0,4.1635976,4.970534528571428,4.6656700875,4.107142857142857,28,"A fantastic and wonderful experience dining in savini! The first of it's kind in Kuala Lumpur. Every mouthful was an experience ,simply divine and delicious! I would definitely dine there again. The ambience is so romantic with lovely music to ram up...",No specific mentions found.,Excellent Exclusive ambiance & superb food!!! My first experience & definitely will not be the last. I booked a private room for 6 pax. The staff are well trained and we were threated like a king in a palace.Feeling at home tho its our first visit.Lo...,"This restaurant deserves every star I have awarded it. The food is amazing, we had the blue fin tuna and prawn stack for a starter and the deep fried mozzarella and both were so flavoursome! For a main we had the lamb shank, mushroom pasta and prawn ...","Fantastic service, presentation and taste! Each dish was a masterpiece! I have been for Dinner and lunch, and not been disappointed. The atmosphere was great! Would highly recommend for business meetings, as they have private rooms available, or for ..."
Secret Recipe,4.09745385,3.0,3.4303976666666665,3.0,4.481776314285715,3.4545454545454546,22,I stopped here for breakfast one morning and it was great. The number of items is incredibly wide and you can find many types of pastries.,No specific mentions found.,"Called in to try the HOKKAIDO baked cheese tart which is really nice, ordered it as a takeaway and sat down for tea. Service for tea was far too long but by contrast the takeaway service was excellent.",I came across this place while exploring the central market for souvenirs. It is located on the ground floor and I went in to try their hot milo [7.08 RM+10% service charges] along with chocolate Indulgence pastry [9.25 RM+10%service charges].The hot...,This place is on ground floor of the Central Market with a nice sitting and break during your shopping. Their coffee and pastries are delicious ...just a little small for the price for a Malaysian thinking..  May be more like tourist oriented
Seetharam,3.911506189473684,3.0,2.05109398,3.0,4.416699033333333,3.4814814814814814,27,Stumbled upon this place when I was touring Little India in KL. I was happy we chose this spot. The staff was super friendly and very helpful. I ended up coming back two days in a row. If you stop in you must try the Samosas and Garlic Cheese Naan wi...,No specific mentions found.,My wife and I were looking for some roti canai. We stopped to look at the menu and an employee ushered us in and told us to sit. The. Another guy came up to us and started speaking a different language. No one speaks English here but they did underst...,No specific mentions found.,"First time visiting Seetharam! Will highly recommend, as food fresh, deliciously tasty, clean environment, and as 'cheap as chips'. Our bill came to 26 myr or £5.20 for two people!! We've eaten in several tourist Indian/banana leafs, and this is by f..."
Senya Izakaya Publika,4.721867984615384,3.0,3.4350449333333333,3.0,4.581928284615385,4.208955223880597,67,I have the largest portion of Pork Curry Katsu Don in my life when I've ordered it for my lunch. I love it so much !!! The price is reasonable and worth to try.,No specific mentions found.,"If you love the authentic vibe of 居酒屋, you'll love this!Fantastic dishes and I love the way how you can take your time and browse through the menu on the iPad. Love the indoor smoking area too. The Hokkaido Pork Don is absolutely the best ever! The k...",No specific mentions found.,"Had dinner here with friends a few days ago.The service was helpful, prompt and efficient, as well as friendly.It is a happening restaurant in a busy part of town. Really loved the bar stool and table seating outside, gave it a very relaxed and """"""""h..."
Senya Sake And Dining - Closed,4.609782988636364,3.0,4.59254537368421,3.0,4.74508971,4.36986301369863,73,"It is a very descent venue for drinks and chilling out with friends!! The food is delicious, very well presented and good proportion!! The pork belly simply amazing and soft crab shelf very tasty!! Self order using ipad and the service was really fas...",No specific mentions found.,"This is one of my favorite place for a nice Japanese food and drinks as it is very close to my work place and where i live. Service are always great, love the ambience of the restaurants and yummy food. Highlight dish is the Hokkaido pork don, the be...",No specific mentions found.,"Good location, very good service, food was very good. Recommended! I was eating sushi, liked it a lot. Drinking green tea and waitresses filled up my cup several times. Reasonable price."
Serena Brasserie,4.417667845833333,3.0,4.597881605555555,3.0,4.657898337931035,4.3304347826086955,115,They serve one of the best hotel buffet in kuala lumpur! The food is really good and tasty. The hospitality of the staff is very warm and friendly!!Show less,No specific mentions found.,"Serena Brasserie Ramadhan buffet dinner was fantastic. We enjoyed the large spread so much on last Friday evening, on 26th June 2015. The services was excellent. We have been greeted by the Manager Mr. Mohd Robae, who did recommended and sharing with...","In conjunction with my nephew's birthday Adam & also celebrating him, as a newly wedded couple Adam & Valentina who just got married in Italy recently, I hosted a dinner at Serena Brasserie on Thursday 19 Dec specially for them together with my famil...","Great food and good choice. Breakfast choices are great. The buffet is pretty good but the choices on the menu are very good and well priced.Kudos to Jason, looked after us very well, anticipated our wants and provided where possible. Thank You Jason..."
Serendib Restaurant & Bar,4.751680042105263,3.0,4.831985685714286,3.0,3.0,4.615384615384615,26,"I love Sri Lankan food and was glad I found this place. the journey was fraught with a thunderstorm on a late evening but we finally arrived.we had the sambal set, the fish cutlet, devilled mutton, crabmeat curry, and a 4 angle coconut that was on th...",No specific mentions found.,visited with family friends. nice ambience and background music. There is a great range of food and beverages on the menu. Excellent customer service. The staff are friendly concerned and Customer oriented. They also serve a good range of beverages i...,No specific mentions found.,No specific mentions found.
Sham'S Cooked With Love,4.710092785714286,3.0,4.623740276470588,4.972160375,4.942284178571429,4.673469387755102,49,"We had a farewell lunch at Shamini's place.She was very welcoming.Foods were delicious.Thanks to her, we had a great time.Show less",No specific mentions found.,"We had a very nice Dinner at Shamini's place. The food she prepared was delicious and we really felt a little bit like part of her Family, it was so nice chatting with her, she explained a little bit of her culture and food. We loved it and recommend...",Dinner was great. Chef Sham gave us a warm welcome. Dining place was well presentable. Served us lasagna for meal and cheese cream brownies for dessert. Food was truly tasty. We had a good time talking to her as she explains and shares stories of hea...,"We had a very nice dinner at Shamini's place. We talked a lot about food, traditions, culture and the local life in our homes. Shamini is a kind and calm person. Her hospitality was great although we were strangers:) The food was very authentic and f..."
Shang Palace,4.436428676612903,3.0,4.244230142372881,3.0,4.386021580555555,4.219178082191781,219,"Let's start with this place's ambiance. The restaurant is beautiful!! I love the red entrance and decor. We were staying at Shangri-La KL and had lunch here. The service was really nice and the food was delicious, very big portions, we were truly sat...",No specific mentions found.,"I went to Shang Palace with my husband for my birthday. I was so happy with my choice. Wonderful staff, delicious food, perfect portions and a great dining experience overall.",No specific mentions found.,We lived in China for 6 years and enjoyed great food there so we were delighted to find that all of the dishes we ordered lived up to expectations. The traditional styling of the restaurant was also very pleasing. Great service and helpful advice whe...
Shanghai,4.651445092307692,3.0,4.12519273076923,3.0,3.550426525,4.116279069767442,43,"A friend who lives here in KL took us to this restaurant as a treat for my birthday while we were visiting. The staff were extremely friendly and attentive. We have been to many upper end Chinese restaurants, but I think Shanghai's way of serving the...",No specific mentions found.,"The service in Shanghai Restaurant are excellent, the people there are so kind and friendly. Good to experience the delicious foods and wonderful service there. Thumbs up! ❤️ Will definitely come back again. 😆 Besides, the environment in the restaura...",No specific mentions found.,I came here with my couple. We had dinner one night. Food and service was great. If we fome back no doubts I will return to this restaurant.Show less
Shawarma Damascus,4.5884733875,3.0,4.3058809,3.0,4.916609133333334,4.28,25,"Staff are very kind and polite, the food is very tasty and freshly made, we ate here during a rainstorm and decided to stay longer purely because the food was so good",No specific mentions found.,The food was great at this restaurant and the price was good too. The service was friendly and was quick.,No specific mentions found.,"We have discovered this Lebanese restaurant thanks to TripAdvisor.This is a good small place, splited in two locations nearby giving on the street. The one near the shopping center offers space inside to sit in a fresher area with AirCon, just ask th..."
Shell Out,4.184407492307693,3.0,3.2133339333333333,3.0,3.0,3.764705882352941,17,"This restaurant was clean and food was great for a Saturday Lunch . People from Singapore, Australia and China enjoyed the food.",No specific mentions found.,Staff are very helpful and the seafood are very fresh. Love it. They provide an apron for you to protect your clothes as well. They give U pens so you can draw anything you want. Good for kids.,No specific mentions found.,A nice place if your looking for seafood and want to get dirty while eating.Price is a bit on the high side but worth the trip.We op for the set A and was told they only have the xl crab and not the L crab so we had to top up RM 18.90 for that buts i...
Shin Nihon,4.637636944444444,3.0,3.8648991333333336,3.0,4.8347346,4.3,30,"The restaurant is fantastic! The food is fantastic, reservations are quick, and the quality is excellent. It has a Japanese feel to it. The space is small, but the interior is stunning. I felt like I was in heaven the first time I ate wagyu beef. The...",No specific mentions found.,"Went here for dinner, the food is fresh and the staff is friendly and helpful. They recommend the food portion just enough for us. 👍🏼",No specific mentions found.,"The best Wagyu, melt in your mouth .. only a bit far off from town .. will definitely come back again .."
Ship,4.555629809677419,3.0,4.0275887625,3.0,3.997353584,3.6666666666666665,75,i always go there for the steaks and the French onion Soup. Its really good and I have been doing that past 15 years . I love their steaks a whole lot.,"Its an old restaurant and the food is at best average. What you do get is the """"""""old style"""""""" methods of cooking and management reminiscent of Coliseum Restaurant on Jalan Tunku Abdul Rahman which better reflects the kinda Colonial character.",I love the escargot.. Wagyu beef.. Everything... The staff also very friendly. I like the environment..and the setting. 👍👍👍👍👍,My Family selected and every year my brother will celebrate his birthday dinner at The Ship restaurant.,Food is good and the price is moderate. I love the environment here and the shows here. different than other places i've been.
Shisha Lounge,4.34806406,3.0,3.4868970058823527,3.0,2.67117452,3.5476190476190474,42,It's one the most popular places for those who want to try Persian food. The kebabs are amazing and highly recommended. Portions are huge and good for sharing. Their Rice is uniqely tasty.,No specific mentions found.,"Excellent food and service. Ambience great. Overall, a pleasurable experience. Will definitely come back when we revisit KL. Taste sensation!!",No specific mentions found.,I was really excited to try iranian food and when someone from iran recommened this place for us i didn't hesitate to go their and it was amazing experience their food is breathtaking i really recommend this restaurant.
Shook!,4.408318414285715,3.0,3.688298672972973,4.960322333333333,4.128149449315068,3.911290322580645,248,It is an impressive restaurant - huge and even has a live band.  The waiters are excellent and the food was divine.  We had seafood galore and loved every bite.  It was a memorable experience.,No specific mentions found.,Loved dinner at Shook! The food was amazing and the live music was great! Definitely recommend this restaurant for an enjoyable experience!,I've been to SHOOK twice and the food is very good I had some escargots as a starter and a nice piece of beef perfectly cooked as a main I could not take a dissert cause the portions for starters and main are very big! The wine list is very good with...,We have been to this restaurant every time we visit Kuala Lumpur (around 6 times now) and the food has always been amazing. Hubby and I love the little seafood platter. We stayed at the JW Marriott so this was nice and handy to our hotel. Highly reco...
Shucked,4.827420907142858,3.0,3.0,3.0,3.0,4.5,16,"In love with the Steamed Lived Mussels style with cream, garlic and fine herbs!! 😋 The freshness of Mussels perfectly matches with the house sauce.  Oysters are fresh! Delicious!! Will be back to this restaurant soon!",No specific mentions found.,"Good food, fresh oysters. Salmon linguine was nice and kids loved it. Very good service with friendly staff! Reasonable prices and a solid drink menu.",No specific mentions found.,No specific mentions found.
Shucked Oyster And Seafood Bar,4.664518417567567,3.0,3.8308463923076923,3.0,3.0843111555555556,4.260416666666667,96,Decent food and  great service at a good price! Very happy with my meal and I will definitely come back and recommend this place to my contacts. Can't wait to try everything else!,No specific mentions found.,We got the Valentines dozen special and loved it soon much we got a second.  Pair it with the house prosecco and you will have an amazing experience.  We will be back soon for sure!!!,No specific mentions found.,Shucked at The Gardens is our go to place to eat. Their menu is quite extensive for a pop up place & pretty healthy to boot. Our kids also love it so it's an ideal choice for a quick snack or a healthy dinner.Show less
Simple Life,4.534202758139535,3.0,3.58663238,3.0,4.178307014285714,4.218181818181818,55,"Loved the food...great selection in the menu. Prices similar to other restaurants. We tried the mains -""""""""Mixed Mushroom Paste with the Multi-Grain Rice"""""""", """"""""Beancurd Roll with Chinese Herbs"""""""" and for beverage """"""""Pineapple + Orange + Honey""""""...",No specific mentions found.,"yes - every mall in KL has a vegetarian restaurant - but this one made my non-veg friends want to order there too.  Nice big servings, quick and healthy.  I recommend the laksa.  Friends liked the noodle dishes and the sandwiches as well.",No specific mentions found.,"Lovely food, visually appealing menu, reasonable prices, and a rare vegetarian chain restaurant find. I returned three times."
Sin Kee Restaurant,4.4369395526315785,3.0,2.8160094,3.0,2.8015886,3.547169811320755,53,The MAN-FAN is one of the best and outstanding too.  I always go here to have my meal.  The last time I was there was few weeks ago and had a Hakka Pork Chop.  I also love the fried rice too.,No specific mentions found.,"This is old Hainanese restaurant that is still survived in KL. Food is great, tasty, delicious and cheap. This place is always crowded at lunch so we plan to arrive late at 2:00 pm. However, service is fast.Just few minutes walking from Sentral LRT s...",No specific mentions found.,"I have always enjoyed eating at Sin Kee Restaurant, simply because of its location and good food"";"" value for money. This place is usually crowded during lunch hour and dinner time which attests to its popularity. Many have eaten here and become regu..."
Singh Chapati House Sdn Bhd,4.3346678516129025,3.0,4.382523966666667,3.0,3.978755325,3.789473684210526,38,My first lunch in KL was here and I was so glad for that decision :). Really good chicken masala and chapati. I recommend it!,No specific mentions found.,"It's a nice job to workers. It's delicious food . It's a healthy foods. I enjoyed to my family members. Thanks to make a decision, healthy and tasty food we our eat . Good job . God bless u . keep it up and well done job to all the workers and chef ....",No specific mentions found.,"We went adventurous and decided on local style food following trip advisor reports. Fantastic tasting food, locals were ordering small pots and an or roti to dip. The small is definitely enough per person. Service excellent and atmosphere superb. Try..."
Siti Li Dining,4.7310942375,3.0,3.3828758222222226,3.0,3.0,3.9473684210526314,19,Just love this Bukit Damansara neighbourhood restaurant. The shop like interior is so original. The Malaysian food so scrumptious. The udang fritters with a hot chilli sauce were perfect. And we both had the seafood mein siam special which was firey ...,No specific mentions found.,I’m so happy to have tried this place today . They have comfortable homely ambiance . Their local food served was fantastic. Food like like homemade cook . I love it ! Perfect portions too. Service was fast and their warm hospitality. They have every...,No specific mentions found.,We had the occasion to visit the restaurant for some late lunch. The ambiance and decor was interesting. Obviously the Owners put a lot of thought into it given it was a sundry shop prior. The menu was quite limiting i thought. Looks like the focus i...
