restaurant,FOOD QUALITY,LOCATION,SERVICE,Topic 5,VALUE,avg_rating,review_count,FOOD QUALITY_text,LOCATION_text,SERVICE_text,Topic 5_text,VALUE_text
103 Coffee Workshop,4.649950745454546,3.0,3.9806617749999997,3.0,3.0,3.9444444444444446,18,Very nice coffee and food. Service was great! Waffle flavour and combination was great and must try!,They serve breakfast and open early compared to other cafe in same area. The menu has simple bread toast and half boiled eggs to full breakfast. They are expert in coffee so they will introduce some coffee options for you to choose.Parking is an issu...,"I have been visiting this café quite frequently. I really enjoyed the food and ambiance. The menu is pretty quirky and the portion of the meal is rather huge. Besides that, the staffs were really friendly and helpful. This is one of my favourite hang...",No specific mentions found.,Good food. Good drinks. Price a bit high but suit the market segment. Pay for the environment and type of customers you see.Sweet potato fries and salad are my main favorite here. Coffee is good but I won't come here for the coffee...i can get the sa...
1919 Restaurant,4.689815496296297,3.0,3.772204127272727,3.0,4.9474944,4.212765957446808,47,"I love the ambience of the restaurant - beautifully decorated, quiet and giving me a sense of peacefulness. Food was served relatively fast. We ordered deep fried chicken in salted egg, Filipino eggplant, curry vegetables and steamed fish in Chinese ...",No specific mentions found.,Brought our 4 adult kids visiting from overseas there and everyone loved it. The food is very tasty and fresh and the service is very good too. We will certainly go back.,No specific mentions found.,Had dinner here yesterday with husband and 19 year old son. We were helped with choosing from the menu with great explanation of dishes and I’m happy to say had a delicious meal. Our host was lovely and took time talking to us about KL and his trip a...
4 Fingers Crispy Chicken,4.039846618518518,3.0,3.12220832,3.0,3.0,3.6176470588235294,34,really amazing chicken. it's some of the best fried chicken i ever had. also the burger is absolutely fantastic! my new favorite fast food restaurant,No specific mentions found.,Didn't expect much but was pleasantly surprised.  Got the mixed box and loved every bit of it!!!!!! Well definitely be coming back here before we leave .,No specific mentions found.,"What food do you crave for on your last day while in Kuala Lumpur? ...4 Fingers Crispy Chicken, of course! That's because they ran out the night before so we made a plan to order early around 6 PM, for our last meal while staying at ALoft at KL Sentr..."
443 Bar Lounge,4.3442302375,3.0,4.312883286956522,3.7036395333333334,4.061707348387097,3.953846153846154,65,The bar staff very friendly and the selection of tapas was good. I'd recommend the beef burger sliders.,No specific mentions found.,"Warm welcome by Reg upon stepping into the bar. Gave us some very good recommendations on the drinks & food, thank u so much! Ambience is lively & able to converse without having to be at the top of your voice. Had italian (prego), awesome stuff ther...","On our second recent stay at the Westin Kuala Lumpur we dined at their Qba Bar and Grill, having dined at their Prego restaurant the week before. We were equally impressed. I am a steak person, so I know a good steak when I have one. I had the tender...",Great atmosphere and vibe from the bar below the restaurant.  Excellent service and a children's menu available (nice suprise in an adults restaurant) plus an activity book for smaller ones!  Food was great.
7Tnine Bar & Kitchen,4.4350285625,3.0,3.971395186666667,3.0,4.942936185714286,3.966666666666667,30,Very nice Indian restaurant. We really liked the good service and friendly staff. The butter chicken is finger licking good!,No specific mentions found.,"We popped in on a Sunday afternoon and the place had a great atmosphere. Beers and eats .. Perfect Sunday session! So good we came back for a sit down dinner in the separate dining area the next night. Attentive staff, lots of vegetarian options!! Th...",No specific mentions found.,"The restaurant located just near hotel strips, me and my friend decided to go there for lunch, nice welcoming staff and good Indian menu, the food was honestly so yummy, definitely will come back again."
Abc Bistro Cafe,4.623033196969697,3.0,3.4056580166666666,3.0,4.485511633333333,3.7903225806451615,62,I loved the Maggi goreng served with a mata lembu (sunny side up). It was excellent as the texture and taste was just on point! Most mamak restaurants in KL often cooked mushy and tasteless renditions of this fried maggi dish. Really overjoyed to hav...,"Love their teh tarik! Not too sweet, just nice. If you're hunting for tosai and roti canai, make sure to be there before 11am because there's no tosai and roti canai between 11am till 4pm! Their roti canai banjir is yummy but curry and sambal is spic...",AMAZING kopi and teh c. AMAZING kambing (goat) biryani. AMAZING roti and curry and cheese naan. And of course AMAZING staff. Thank you for the delicious food!!!,No specific mentions found.,"Came here because we feel hungry at the night after walking around KL, and quite surprise because Teh Tarik just 1 Ringgit and Roti Canai just 1,4 Ringgit. I feel like wanna cry because those food are delicious but also really cheap. We are feel bles..."
Abc Foods Corner,4.145335023076923,3.0,3.0,3.0,3.0,4.0,15,We went to have lunch at this restaurant. This place is very clean and the staff are very efficient and quick. The lunch rice and curry was really amazing. My wife had Sri Lanka lump rice and we also ordered chicken biriyani. The food quality was rea...,No specific mentions found.,"ABC Food's Corner (yes, the apostrophe is really there) was a pleasant surprise. It was recommended by the staff at the Grand De Orchid Hote,l where I stayed on my visit to Kuala Lumpur. A review of the hotel will be submitted shortly. I approached t...",No specific mentions found.,Good place to enjoy banana leaf meals. Located near Masjid India and the area is very congested most of the times.
Absolute Thai,4.226689092982457,3.0,3.202428541935484,3.0,4.57664325,3.642857142857143,98,"I had lunch with my friends on a working day while in KL.The food ordered there are delicious. The soups which we had are extraordinary in taste. I enjoyed all the items and especially the omelette, which is superb. A great day to remember with all n...",No specific mentions found.,This restaurant offers great food at affordable prices. It was my first time tasting Thai cuisine and I loved it. For anyone who is in love with Thai plates will surely love dining in this restaurant.,No specific mentions found.,"Our very first Thai Food in Kuala Lumpur and we were so glad that we gave it a try.The food was at it's best, service was good and had a nice ambience. It is located within the Berjaya Times Square Mall so it made it even more convenient to have a me..."
Acme Bar & Coffee At The Troika,3.7308048036363637,3.0,3.340381768085106,4.436400416666666,4.014498027999999,3.336206896551724,232,"I was very happy that I came here. First off, the atmosphere of this place is really awesome. It has a very modern feel, but is also made to be homey with lots of plant life. I loved their very large windows. What set this place apart was that I had ...","The deco and interior of the cafe is very well done and beautiful. It has a very rustic look and since I was there during Xmas period, the lights and christmas decorations made the entire place very warm and welcoming.It has an outdoor seating and se...","Very recommended! Foods, drinks and cakes are very nice. And the employees are very friendly. Very nice ambience and design."," Great dinner at the acme cafe bar, had our usually scallops Aglio Olio soagetti simply delicious and awesome with American breakfast with refreshing poach eggs"";"" sasauges and button mushroom that is appetizing. Not forgetting their sizzling famous ...","Acme Bar & Cafe was also known as ABC. This is really a nice restaurant. I was there having my dinner. The restaurant design was great - Simple, Nice & elegant. I love so much of the design. Service provided was excellent. Food was so tasty & delicio..."
Ah Koong Restaurant (Pudu),4.327035409523809,3.0,4.537640499999999,3.0,3.0,3.730769230769231,26,"Love their servings, especially loved their Tom yum soup and white rice noodles with the fish balls! Lots of drinks also on offer.",No specific mentions found.,one of the most visited restaurant and staff at 1u outlet are attentive ....foods are great and staff helped to get you table during peak hour,No specific mentions found.,"I am a local,work near by this restaurant. I have been here many times. Recently I saw many travellers purposely drop by here for a meal. So that I would like to write a review,hope it helps traveller. The food taste just normal,as in ok,not bad. Pri..."
Al Andalus Restaurant,4.0288195857142854,3.0,4.551770599999999,3.0,4.196964975,3.8666666666666667,15,"Great place for good, tasty, reasonably priced Middle Eastern food, which was served rather quickly. Really nice for chilling out with buddies too with shisha.",No specific mentions found.,Alandalus is a nice place to eat smoke shisha and have a great variety of food. You can try the BBQ or try the Libyan couscous which is awesome the food comes in big portions. The staff are helpful the place is clean and well maintained Special thank...,No specific mentions found.,"We stayed in an apartment within 200m of this restaurant and dined here at least 7 times in the 2 weeks we were in KL. A good place for a quick lunch or to have a lingering evening meal. We tried many dishes (easy to share so we could try more), all ..."
Al Diafah Express,4.940164775,3.0,4.808257733333334,3.0,4.421424466666667,4.5,18,Nice restaurant with great food good service love it all especially the mendy rice with lamb And the bbq dishes 😋,No specific mentions found.,"My husband and I have visited here many many times. We love it. We love the ambiance, the customer service, but we especially love love love the food.We have taken many friends here and they have fallen in love with the place. We went again last nigh...",No specific mentions found.,Exclusive restaurants with very nice interior designing. Located at Seri Petaling. You will feel very comfortable with nice environment. Food is excellent and price also medium to high level. Toilets very clean. Very privacy. Normally suitables for b...
Al Halabi Lounge,4.7259985625,3.0,4.650334457142857,3.0,3.0,4.352941176470588,17,"The best arabic restaurant in Malaysia, the food taste & quality are excellent and fresh all the time. The prices are really suitable compared to other restaurants in the area.",No specific mentions found.,We had been here for 2 consecutive nights.  Lovely environment.  We love the food and will definitely come back again.,No specific mentions found.,"Al Halabi is one of the places I would go to almost every day in Kuala Lumpur.As a sheesha aficionado, the sheesha here is above average, but to be able to do it in the air-conditioned comfort of a sofa, with beautiful lighting and good food is what ..."
Al Rawsha Restaurant Kuala Lumpur,4.363758472413793,3.0,4.4903351625,3.0,4.3627039875,4.108695652173913,46,"Firstly, you cannot take your eyes of the Restaurant, it looks just like a Castle!Very easy to find parking and I was surprised this is open 24 hoursThe Staff is extremely friendly and very politeThe Decor is simply outstandingThe food menu has huge ...",No specific mentions found.,"Great place, loved the food and the area! Shannon was amazing, and I would definitely come back. 10/10","The lamb pieces were so succulent always.portion is also huge.better still,you can get it 24/7!the place is also majestic,literally,coz you are inside a castle.","It has been a long long time since I have been eating here. I still continue to do so as it has become more of a hangout place for me as I know the owners who are exceptionally lovely people. Try out my favourite here, Mint and Cardamon Black Tea pot..."
Al-Amar,4.238013997986577,3.0,3.8726714384615386,3.0,4.695142505084745,3.944055944055944,286,We had a lovely evening meal at Al-Amar in the Pavilion Mall.  Excellent Lebanese meze food and delicious hot bread for dipping.  The service was good too.  One of the nicest meals we had during our stay in KL.,No specific mentions found.,"Introduced to this place by Ms. Aisha. Went there with friends today. Greeted and served nicely by the waiters/servers and even the manager. Love the food especially the Lamb Shank Briyani, the soup and the Kunafa. Delicious! 5 star for Al-Amar! Defi...",No specific mentions found.,"I love their Dancers I think on Weekends :) The crew are very friendly and the dancers are beautiful and very well skilled. It's a great place for a middle eastern food as well as relaxing for hours, besides it's very close to Bukit Bintang."
Al-Amar Express,4.561036572727272,3.0,3.2827116166666666,3.0,4.505858611111112,4.0,26,We just had a quick lunch. The food was excellent... so tasty.. and the service was very professional. Would highly recommend,No specific mentions found.,visited this restaurant a couple of times in my visit to kuala lumpur. food was always good as well as the shisha 👍🏻. would definitely recommend this place for people who like shisha and lebanese food. service is slow when the restaurant is packed.,No specific mentions found.,A good place to visit. Very friendly staff . Clean and nice place. Food was good too. Location ideal in front of pavilion.
Al-Halabi Gourmet Restaurant,4.56239771780822,3.0,4.2113460371428575,3.0,4.7999724666666665,4.4393939393939394,132,"We had a family dinner here recently at the recommendation of a friend - and were delightfully surprised! The service was extremely attentive, and the food was delicious. We ordered a huge variety of appetizers, mains, rice and barbecued meats, and l...",No specific mentions found.,I just chanced upon this restaurant. Awesome food and great service! Thank you for the delicious food. It was the best on this trip.,No specific mentions found.,"I love this place, food and atmosphere. Great dish selection, and good options for all. I keep forgetting to take pix, because we all dive right in and enjoy every single bite! GO HERE!!!"
Alexis,4.329871756521739,3.0,3.467663089361702,4.720327308333333,4.401317983333334,3.588709677419355,124,"After shopping at BSC, there is no greater place than Alexis where one can get not only good food but fine wine too! it is a great place where one can order not only Malaysian style dishes but western menu too.","Love hanging out here with some of my long lost friends, chit chatting while having some Alexis cakes accompanied with a cup of earl grey tea. Cakes and teas are the best combination for tea time breaks!",The tuna salad I ordered was so delicious and restored my faith in dining out again!!!! Service was top notch- amazing and friendly. Ambience was really nice with French music playing in the background. Absolutely loved it!,"Every time I came to The Gardens, I see a lot of people patronizing this restaurant. And I'm glad that at last... I am 1 of them. The staff are friendly. The main reason I'm attracted to Alexis due to the wide varieties of cakes to choose from.... We...","I like this restaurant. food quality, varieties, services, ambience, all suit me so well. it's at a corner of garden mall,  a cosy place for lunch or dinner. i have lunch here at least once a week. strongly recommended."
Alexis Ampang,3.613238857142857,3.0,4.028072576923077,4.931020666666666,4.2992357,3.652173913043478,69,"Their food certainly satisfy the taste buds but never make you too full. Love the tiramisu cake so much! It is not too sweet and the ingredients are rich and generous, unique combination. Not to forget the attentive and friendly waiters. Great ambian...",No specific mentions found.,It was good night out with my gf (now my wife). We had red wine and we both enjoyed the jazz music that night. The cake was delicious and my wife loved it so much that she always ask me to bring her here again.,Tea for two brought us to Alexis at Great Eastern Mall. I had a pot of peach green sencha tea and a large serving of pavlova. The pavlova was deliciously light and easy to finish. It was raining and we decided to stay for dinner. I decided on the mus...,"The best thing about Alexis apart from the heavenly Pavlova, is that the menu caters for everyone. Though the menu doesnt have a lot of options but it does have something to everyone. Western, local Malaysian, Indonesian, Italian etc. Their pizzas ar..."
Alexis Bistro,4.266523077777778,3.0,3.6158378666666664,4.8390196625,4.4854867,4.0,36,"This place has always maintained their food quality and good service! Today we had the fish and chips, the duck confit, chicken rice and pecan pie with vanilla ice cream. Everything was good. Would definitely recommend this place and will definitely ...",No specific mentions found.,The one place that served good food and amazing cakes. Not to forget their pavlova which i think still is the best in KL. Never fail to visit this bistro when im in KL. Oh my alexis pavlova!,"Been going to Alexis for the past 5 years and i'm pleased that the quality and flavour is still as good as when it started. Their pavlovas are definitely one of the best in town. Besides desserts, their main meals are great too.","This conveniently located bistro is known for its food, but while we have been here quite a few times over the past years, I must admit we've never tried anything but their delicious cakes and sweets and outstanding hot and cold drinks.It is relaxed,..."
Ali,4.374377446666667,3.0,3.870428066666667,3.0,2.59215415,4.027027027027027,37,"Muthu & Ah Hock,Love that it has lots of varieties to suit my family's different preferences. Their mee goreng mamak is awesome and so are their nasi lemak. Would definitely come here again.",No specific mentions found.,"Muthu & Ah Hock,Excellent services and very delicious dishes! Love cham very much ❤️ Hope to come here again after this",No specific mentions found.,"Muthu & Ah Hock,""""Haven’t been back here in ages, they have done some renovations which have expended the size of the restaurant, typical Asian service, lots of staff but very lazy, otherwise good place for nice casual Malaysian food"
Aliyaa Island Restaurant & Bar,4.5992811343434346,3.0,4.766917530555556,3.0,4.491617866666667,4.437086092715232,151,"Brought my family to eat here for the second time and Aliyaa have outdone themselves again! We had a wonderful meal! We had the mutton pal poriyaal, brinjal monju, Lumprais (which they only do on Sundays and which you have to try because it so so goo...",No specific mentions found.,I would highly recommend here as the service and food are sooo good . Staffs here are very friendly and helpful and the food here is very delicious ! I will definitely come back with my friends next time ! Cheers ~,I had the Sri Lankan version of our nasi lemak. With Lamb. The condiments was interesting. Caramelized onions. A Coconut sambal and so on. The lamb was good except that there were too many pieces that was a tad tough. The apps superb as usual but I m...,"Loved everything about the restaurant, first time i went but felt like home, the service is great they recommended all the dishes which were great, the lankan crab is a must. Would recommend this restuarant to anyone looking for great food and servic..."
Altitude,4.7034664,3.0,4.477709383333333,3.0,4.307069666666667,4.1875,16,"The afternoon tea service was excellent, with an immense number of items followed by a spectacular dessert assortment, almost too much sugar!",No specific mentions found.,"Great food - the tenderloin was amazing! Ambiance was great with an amazing view of the city. Good re-opening discount as well. Staff was friendly, Azmi was outstanding. Will definitely return.",No specific mentions found.,"Was here with my partner for my birthday celebration and it was the best. Every pastry and dessert was up to perfection, from taste, visual, experience and servicing. The view was simply best, and being small and cozy enough, there wasn't big crowd l..."
Amarin Heavenly Thai,4.39067019375,3.0,4.0319724692307695,3.0,4.9371531,3.980392156862745,51,My friend and I love all the menu especially the deep fried fish with thai sauce. The Tom Yam was superb and hottt. We had our reunion there because of the ambiance. Cozy and Yummylicious!!!,"This Thai food place is ambient, calm. the aroma of Thai was in the air. I recommend this Thai place for anyone who's finding good Thai food in Malaysia. Pair up the green curry and pineapple fried rice, it goes really well together and also try out ...",I had a dinner with my husband on his birthday (6/10/2017).The food is really superb and the service is great.The food is not cheap but really value for money.We really enjoy the food.I would definitely go back again..,"We enjoyed good Thai meal at this restaurant, twice during our stay at KL. The food was awesome, specially their green and red curry and Pad Thai. Since it was my birthday, the staff made it extra special by serving coconut icecream and singing a Bir...","The food is lovely and service was excellent. One of the best upper-middle class Thai restaurants around. I believe this is part of a chain of restaurants under Absolute Thai. Anyway, will be one of my family's must-go restaurants whenever we are at ..."
Amber Chinese Muslim Restaurant,4.235420141666666,3.0,2.4895140000000002,3.0,4.24306756,3.78125,32,"Fell in love the first time I went there. I tried the beef ribs (rm48 I think, but it was very worthit). They were so juicy and marinated extremely well for the taste. The Beef noodles are also my must have everytime I visit the place. Freshly pulled...",No specific mentions found.,"Been here twice. Once when I organize a team event and recently during iftar - ramadhan with friends. In both even the food selection was variety. a lot of options. place was clean, customer service also good.",No specific mentions found.,This is an excellent restaurant with a great selection of food - including vegetarian options. Some of the dishes were slightly unusual compared to similar restaurants at home and so it was an interesting experience as well.
Anjappar Indian Chettinad Restaurant,4.009069513043478,3.0,3.3324201285714286,3.0,4.4052004875,3.7049180327868854,61,This is one of the better restaurants serving authentic Indian dishes which I find to be very nice and tasty. The restaurant is also well set up and very much to my liking.I tried a few dishes and I know I will be coming back for more..Show less,No specific mentions found.,We were walking around and we happened to have lunch in this restaurant! Amazing the people were nice and the food was so good. Really a nice adress!!! Thanks so much!,No specific mentions found.,We had the pleasure of having dinner at this restaurant during our recent trip to KL. We thoroughly enjoyed the food that we ate here - we are not experts of Indian cuisine but what we had we loved. Prices may be a little higher than street vendors a...
Annalakshmi,4.592537301111111,3.0,4.048526213157895,3.0,4.4535666,4.277777777777778,144,it's too delectable & scrumptious! The buffet is so cheap & their attitude is really amazing! They serve us very well. My Korean American guest was so happy with my recommendation. Remember to try the beetroot Poori,No specific mentions found.,Loved the ambiance here. It feels very cosy and calm at the same time. A great place to bring friends over for some good food and good conversation!,No specific mentions found.,"I’ve heard of this restaurant but never visited it until now. A treasure!The restaurant attracts all walks of life and draws all races to it. It serves only vegetarian food in a buffet style.I enjoyed the various curries, freshly made chapati and the..."
Anne Elizabeth The Deli Restaurant,4.281354321052632,3.0,3.8081039666666663,3.0,4.454150933333334,4.193548387096774,31,"Many items are really nice for a try, overall and service is great. Will visit again for others occasion.",No specific mentions found.,"Celebrate colleague birthday over here , Very satisfied with the dinner and their service, will come again very soon.",No specific mentions found.,"Undoubtedly, the best western deli I have ever been to in town. Everything is spot on! You can evaluate through the crowd every evening, especially weekends.I have tried the steaks, the pork belly, the pastas, all taste very good. The meat here are g..."
Antara Restaurant,3.348387209090909,3.0,3.87680566,3.0,4.720466325,3.590909090909091,22,"Great twists on Malaysian favourites. Very nice food! Some items very pricey, but many are very reasonable. All yummy!",No specific mentions found.,I was looking for something special for my daughter's Birthday dinner.I saw it is good review and fall in love with prety building. I contacted the restaurant and owner chef replylied me. She was very nice and helpful.All staff were friendly and nice...,My parents and I visited KL for the first time this month. It was my birthday while we were out there so we wanted to go somewhere special. We chose this restaurant as the food sounded delicious and the staff were so friendly and helpful when we went...,Heard a lot about this restaurant so I decided to go with some friends and family and we were amazed at the quality of service and food. Had the lobster for main and the portion sizes were great too. Would overall recommend this place to anyone that ...
