restaurant,FOOD QUALITY,LOCATION,SERVICE,Topic 5,VALUE,avg_rating,review_count,FOOD QUALITY_text,LOCATION_text,SERVICE_text,Topic 5_text,VALUE_text
Fong Lye,4.6082863631578945,3.0,3.129218971428571,3.0,3.3228244599999996,4.064516129032258,31,Fong Lye has been a little home cooked restaurant that my friends and family have been going since the eighties and they have always been consistent and delicious.This has been weekly affair for us and glad they brought back the “chilled lemon juice”...,No specific mentions found.,We went on Sunday during dinner time and the place was packed. Luckily there was one table left upstairs. We went to their restaurant located in Sri Hartamas. We liked the decor very much and the service provided by the waiter on the upper floor was ...,No specific mentions found.,"Of all the Fong Lye outlets, this is undoubtedly the best. Food tastes great and original and service is good. Though the space (ground floor) may seem a little pack at times with the crowd, there are no complaints and worth it. Parking may be a litt..."
Fong Lye Fusion,4.3620813375,3.0,2.701179066666667,3.0,4.097593128571428,3.7941176470588234,34,"Having lunch with a friend, food was presentable and deliciously good. Warm lights makes the food looks even tastier.",No specific mentions found.,Steamboat is delicious and value for money. Waiters are friendly and allowed us to move to another table to place the birthday cake so we can feel comfortable and take a group picture. One of the waiters gladly took pictures for us. Spaces and clean.,No specific mentions found.,This is one place where you can close your eyes and point on the menu and the food will turn out good! Many items on the menu are comfort food.
French Feast,4.381828588888889,3.0,3.367292485714286,4.978948333333332,4.0188637,3.769230769230769,26,I strongly recommend the French Feast in Kuala Lumpur! Very delicious food and cheese (St Marcellin miam miam) more particularly the weekend brunch! Very nice staff and a very convenient location 👌 - Corenthin,No specific mentions found.,"We went with friends and had a lovely dinner. It is quite open so was a bit warm, but service, wine and food were great. I had the grassfed tenderloin and goat cheese salad and they were excellent. Our desserts were delicious. Best of all was the ver...","Had a wonderful birthday dinner with my spouse . Started with a glass of red wine , my entree oxtail and onion soup was a surprise and nice . My mains was duck and my partner had sausages. We love it !",This new location just off Changkat Bukit Bintang has a great ambience. The chef is full of personality and if you're lucky enough to be there on a night when he is interacting with guests you are guaranteed a wonderful time. Excellent French cuisine...
Fresca Mexican Kitchen & Bar,4.389794125,3.0,3.71931242,3.0,4.382869070588235,3.9270833333333335,96,"I visited this Mexican restaurant a month or so ago. They catered for my friend's baby shower luncheon with a great buffet spread of yummy Mexican delights. Everything was so tasty especially the Jalapeno Poppers with mango salsa, guacamole"";"" the en...",No specific mentions found.,"We go to Fresca on a weekly basis, we love so much about it. There is a kids menu that is reasonably priced. There is now a vegetarian menu at my suggestion ( thank you for listening) love the mango salad here a must try. Dominic makes the best marga...",No specific mentions found.,"Fresca Mexican Kitchen and Bar just packs in all the right ingredients for a great time out with your family or friends ! The food is bursting with flavors, the menu not quite the usual tex-mex and refreshingly different, the service is superb, the d..."
Frisky Goat,4.496028707407407,4.96988256,4.58132569,3.0,3.860553557142857,3.9661016949152543,59,The food is just awesome!! Very reasonably priced n tasteeee! We had brunch here & their signature dish is the cheesy waffle wz eggs benny wz either smoked duck or salmon!! Aaaaamazing is an understatement! Loved it!! The coffe is good as well! Staff...,"A must try here are the Danish Pastry, they are really very good. The breakfast menu is also very good. Overall this is a very nice place to have a 8am breakfast & coffee. The place here is really cosy and perfect for couples having breakfast or lunc...",Love their innovative menu.... Service is good.....love the ambiance... Cosy & warm! Been here a couple of times for breakfast & brunch. Never disappointed. The pastries are yummy too,No specific mentions found.,Can't rave enough about how awesome this place is. Eaten here many times and had various menu items - all are wonderful. Staff are always friendly and welcoming. We just can't get enough of it! Fabulous cake - perfect indulgence! Been to other places...
Fs Nasi Kandar Corner,4.540457514285714,3.0,4.443647410344827,3.0,4.545921485714286,4.413043478260869,92,"Great food! Awesome waiter, very helpfull! If you visit KL visit this place! That's just doing yourself a big and very cheap favor!",No specific mentions found.,I had a great time with my family. The staff is very friendly and the food is just delicious. Nice place to go in Kuala Lumpur,No specific mentions found.,We spent a good moment at FS nasi! The food is good and the staff is very nice. Will come back with pleasure next time in KL!
Fuel Shack - Terminal Bersepadu Selatan,3.6086385,3.0,4.0916889888888885,3.0,3.0,3.586206896551724,29,"Never did I expect to get a top notch burger at a bus terminal that too from a outlet which looked like just another fast food outlet but was pleasantly surprised! I had their original burger""; 150g patty with cheese & lettuce, it was goood; the patt...",No specific mentions found.,"Awesome food and atmosphere! Incredibly helpful staff especially Indah, lovely happy lady. Try the cheese fries and the cookies and cream shake! Delicious meal.",No specific mentions found.,"Incredibly tasty burgegr and nice staff! One of the beat butgers i have ever tried, definetly a place to stop if u r close !"
Fuel Shack Signature,4.354833702325582,3.0,3.5864708142857142,3.0,4.425317705882353,3.8768115942028984,138,Food is really good especially the burgers and red curry pasta.  Staff is really friendly.  This is our fav restaurant in KL and we have eaten here 3 times in 6 days.,No specific mentions found.,the ambiance was nice. the food is new for me. since I always eating seafood aglio-lio but here they only have beef strips. which is very delicious.. the service also is good!:) defenitely will come back!,No specific mentions found.,"If you're looking for some real Western food, real beef grilled burgers supreme, pasta like you never had before, steak to beat your socks off and endless list of beer and spirits all served with a great smile and real welcome, you've got to get to t..."
Gastro Sentral,4.504158219117647,3.0,4.746383415517242,4.764531206666667,4.477598378787879,4.568965517241379,290,Love the foods there! PowerSalad was great with the sauce on side. Try the Soup Ekor with Roti Bai; I will definitely come back for this !! Thank you for the great services too !,No specific mentions found.,"A great night to remember! Happy Birthday to my dad and Happy New Year! The staff here is very exclusively friendly and always ready to get it work on any short notice surprise. Amazing guys! Keep it up! Special Thanks to Ros, Nik, Rina, Teddy, Ruben...","After trying out Prime, Latest Recipe, and Favola, we had our lunch here at Gastro Sentral. Overall very good - the people, the service, the atmosphere, the deco, and the food! Love the 22-hour Braised Wagyu Cheek. Foie Gras Burger is good (even bett...","We had a very good experience @ Gastro, the new menu is awesome and the service is first class! Go there, you can't go wrong. We come without any expectations and we were pleasantly surprised."
Gavel Coffee Kitchen Craft Beers,4.824926707142857,3.0,4.40960535,3.0,4.3838427,4.390243902439025,41,"Delicious European style breakfast and lunch at very reasonable value. Awesome funky interior and exterior with cool wall art. Great air con, WiFi and very friendly staff. Food is fresh and delicious!",No specific mentions found.,"Had a lovely delicious brunch! The place is very cute, people are so nice and they play chill music. They give a free pastry if you drink tea or coffee😍 I would definitely recommend this place!",No specific mentions found.,We have recently returned from K.L. where we discovered this restaurant just around the corner from the Stripes Hotel. The food is lovely rice and noodle salads are amazing and everything in between is fantastic. The staff are lovely and Denise is th...
Gem Restaurant,4.404282177941177,3.0,3.0234178833333334,3.0,4.549041455555555,3.7876106194690267,113,We had a great time in here. Halal was absolutely mouth watering! We definitely enjoyed our lunch! Thank you!,No specific mentions found.,"Top place for Indian food in KL! Amazing staff, super friendly and helpful, nice atmosphere, clean place, quick service! Would highly recommend having meal there!",No specific mentions found.,We dropped in by chance and were very satisfied. Great menu and very friendly staff. The food was great and the price was very reasonable.
Geographer Cafe,4.371266633333333,3.0,4.956792923076923,3.0,4.640159128571429,4.586956521739131,46,"I stumbled across Geographer Cafe, and I’m so glad I did. This was my first meal in Malaysia and it’s set the bar high. Lovely decor and atmosphere but most importantly, great food. I had the set lunch menu (served from 12pm - 3pm) which included a d...","The full English breakfast [the daily brunch] was easily the best breakfast I've had in my life, and I've had tons of them across UK, and three continents. Sausages were handmade, bread was a true sourdough crisp heaven and the eggs were just pure bl...",Really love its ambience of the cafe. There are lots of selection of vegetarian food as well. I will definitely visit there again!,No specific mentions found.,We had lunch here few times with family and friends. The food here are just wonderful and we have great memories it seems. The environment here also nice and hardly can find in the middle of the city. Great jobs!
Gin Ger,4.348943039130435,3.0,4.181735466666667,3.0,3.9626523000000002,4.172413793103448,29,The Thai food is absolutely delicious and the price very reasonable. Authentic atmosphere. Try the green curry! Yummy!! It's always a feast to go here. I take all my friends there.,No specific mentions found.,"A really good surprise. We did not know what to expect from this restaurant. It was full of tourists, more expansive than other restauratns...so it could have been delicious or just a tourist trap. Luckily it was very good :)",No specific mentions found.,"Vegetarian options! These were the best spring rolls I've ever had! It was convenient while shopping, affordable and clean. My friend and I ate there twice on our trip. I also had a green veg with a delicious touch of roasted garlic."
Ginger Restaurant,4.514434103773585,3.0,3.2081014380952384,3.0,4.534903326315789,3.860215053763441,93,"After many hours of shopping, finding Central Market was a godsend! I had no idea that we would literally stumble across this great restaurant! Ginger was such a great find! The food was exceptional, the service courteous and friendly. I had the Beef...",No specific mentions found.,This is a delicious Thai Restaurant on the 2nd floor of Central Market. I had the Green Curry the first day and the Red Curry two days later. My wife had the Coconut soup the first day and TomYum Soup two days later. All were wonderful. The staff was...,No specific mentions found.,Absolutely come back again.This is one of the best places for eating during our trip to KL. The restaurant is located on Market Central. The food all tastes super fresh and is plentiful. The food is beautifully presented and the service here is secon...
Ginriksha,4.297462617647059,3.0,4.436440885714286,3.0,3.0,4.076923076923077,26,"Absolutely delicious, a real unique take on Northern & Southern Indian cuisine. Everything was divine. A must try include the cranberry cream cheese, mutton quesadillas, yogurt chaat bomb! I've achieved food nirvana.",No specific mentions found.,"Love this place. The food is good, the service is excellent. Love their cocktails – so many choices catering to different palettes.  The ambiance is very nice. Love the bicycle wheels on the ceiling.",No specific mentions found.,"The recipes here pack a full punch of flavour. My western taste buds find it a bit much, but friends who are more accustomed to complex recipes with many ingredients really appreciate the food here. Nice decor and a good bar."
Glass Tartines And Tipples,3.9778757875,3.0,4.34364794,3.0,4.87892346,4.142857142857143,28,"Love this place as well as the food and beverage. I bet the coffee latte, hot chocolate it serves are even better than that of famous franchise outlets. >5 star. Thanks.",No specific mentions found.,"This place is really fantastic. A wonderful selection of wines, beers (craft) and cocktail. The food is outstanding and very reasonable priced for the big selection of gourmet meals. Owner and staff r so friendly. This is a wonderful place.",No specific mentions found.,Convenient location. Good ambience.  Cozy and comfy. Food and beverages were excellent. Suitable for business or casual meet up or family meals as well.
Go Noodle House,4.217099385,3.0,3.67299299,3.0,3.0,4.096153846153846,52,Love the mixian noodle here very very much. Everytime coming here I all order mixed fries bcs it really goes with the soup. Should give it a try!,No specific mentions found.,Must Recommended Place if you love noodles. We must take queue number to get a seat but it's worth to wait since the food is so delicious. Their herbal tea also nice. And we love the ambiance here. We would like to go here again if visit KL for the 2...,No specific mentions found.,The best meatballs ever!!! We came to the restaurant 2 times in a row in 2 days. Will surely come back again.
Gobo Chit Chat,4.149032948514852,3.0,3.4399568527777777,4.232611375,3.863684477419355,3.8372093023255816,172,"Great choice to start the day with! Buffet breakfast is great, with so many dishes and drinks! The pastries, fresh fruit juice are great! I woke up early everyday just not to miss my breakfast!",No specific mentions found.,"Had a quick lunch with good food and service. Food is yummy...thanks for the chefs, service is excellent!","Celebrated 2 years wedding anniversary with My husband last week at Gobo Chit Chat. Great Choice of food, Fresh seafood, Fresh oysters. Service is great. Spoke to Restaurant Manager Naresh regarding our anniversary, He surprised us with a slice of ca...","The breakfast buffet was amazing. Multiple cuisines, with lots of freshly made options. Well worth visiting as part of your stay at Traders Hotel."
Gobo Upstairs Lounge & Grill,4.203942434210526,3.0,4.160551758241758,4.337441731818182,4.507806231521739,4.193415637860082,243,"We had a really nice meal here on 2 different occasions.  They had a crab carpaccio, it may have been a seasonal specialty, but it was delicious.  Highly recommended.",No specific mentions found.,"We loved our meal here. We ordered the salmon risotto and lobster pasta. It was gorgeous. The service was excellent, staff extremely attentive and our waiter Romario was extremely efficient and lovely! He gave us great ideas on what to see in Kuala L...","We celebrated my husbands 60th birthday on 30june at this restaurant. The food was magnificent and the staff was great. They had a beautiful cake and the table was decorated beautifully. The price for good food, well prepared was great.","This restaurant inside |Traders Hotel was fantastic!  My husband had lamb and sirloin combo and I had prawns, both were amazing!  Top class restaurant with fabulous service, great views of the city too!"
Goodness Greens Cafe,4.167427819047619,3.0,3.2144312,3.0,4.748119233333333,3.9285714285714284,28,"Absolutely love this place! I’m so glad that they are back on food panda in my area. I advise everyone and anyone should try this place, the food is fresh and tasty and creating your own salad means that you can ensure you have everything that you wa...",No specific mentions found.,Been here on a number of occassion. Everytime is a wonderful experience. Love the fact that I am able to craft my own salad. Love the Beet Aid Juice drink. Ambience is nice. Wait staff are friendly. Though the food is slightly pricy but Goodness Gree...,No specific mentions found.,"Good and calming music, great food, love their salads and wraps! Parking is a nightmare, as any other place around Taman Tun but once you walk into this cafe, everything will sort itself out!I love salads so this place is some kind of heaven for me.F..."
Grand Harbour Restaurant,4.387202372,3.0,3.443105053846154,3.0,3.4554339666666665,3.7560975609756095,41,"Located in the middle of KL city Golden Triangle, we had lunch here and really enjoyed the food. The roast pork is really tasty. The variety of dim sum is just nice and service was fine but can still be improved. The yam bun is my favorite, its reall...",No specific mentions found.,"Always a family favourite!!!! Family loves the noodles, char Siew pastry, and I love the radish cake!! Service has always been five stars too. They even gave us free desserts because of winter solstice the next day!",No specific mentions found.,"My wife and I had yum cha (aka Dim Sum) here recently, during our holiday in Kuala Lumpur. We were staying at The Grand Millennium Hotel, which is just across the road from Fahrenheit 88 shopping mall, where this restaurant is located.The food was ve..."
Grand Imperial Restaurant,4.31141061025641,3.0,3.86493625,4.961760833333333,3.3049241888888887,3.912280701754386,57,"We celebrated my father-in-law’s 90th birthday at Grand Imperial restaurant. Service was excellent. We had a private room for the nine of us. We had an excellent 7 course dinner, including suckling pig, grouper cooked in front of us, king prawn, birt...",No specific mentions found.,The food here is good though a little pricey.  Here are the photos of the excellent dinner we had at Bangsar Shopping complex,"We were invited to attend a birthday dinner. The food and it’s presentation and service is way above excellent..... just fabulous!!! To mentioned a few.....The London duck, Iberico ribs, steamed fish were cooked perfectly. The long life noodles cooke...","A very good place to go for a formal dinner or a celebration.  Plentiful food, high quality service and variations on the theme well catered for!  Food tasted as if it had just been cooked!"
Grandmama'S,3.6175922266666665,3.0,3.4061126500000003,3.0,4.5372034,3.642857142857143,28,"well trained staff, attentive and very helpful. Very fast in serving of food. Place is so beautiful and spacious. Located in KL Pavillion it's best place after you shop. Taste is very authentic malaysian. I tried there best chow kueh teow and hakka r...",No specific mentions found.,"Went there with my working colleagues it was a office dinner, the food was just amazing and delicious, good service. We all just love the food and overall we enjoyed our dinner there, highly recommended restaurant.",No specific mentions found.,"We ate in grandmama's, and everything we ate was amazing. The service was very good,aand the food was fresh and well-cooked."
Grandmama'S Intermark Kl,4.342909371428571,3.0,3.709389169230769,3.0,4.7315032,3.657142857142857,35,"Surprisingly, I really like the food here! I had a lay-over for 2 hours and enough time for me to eat. The view from the window is so nice! Food price is reasonable as well and big serving! Would definitely will dine in here again when I catch a flig...",No specific mentions found.,"I visit Grandmama's at Intermark Mall almost every other week. I love coming here because the restaurant is cool and comfortable, the managers are very friendly, with a nice personal touch in their greetings and services, and of course, the food is g...",No specific mentions found.,My wife and I had dinner here last week and the food was fabulous
Gravybaby Jalan P Ramlee,4.737170051612903,3.0,4.804889359813084,3.0,4.924405481818182,4.656441717791411,163,We went tonight and shared a pizza and the chicken kebabs the food was amazing and the service from our waiter Kowser was great. Highly recommend!,"Went on a family trip Belfast with my family.stopped off at gravy baby klcc to grab some food.service was great.food was beautiful,big shout-out to Alam.great service and funny,huge asset to the branch.","Had an amazing time, good food and drinks.. me and my bf enjoyed my favorite cocktails in here.. heaps of thanks to Omar for giving me the best customer service ever! Will be back here for sure..",Great customer service from Sazzad who made our desserts and cocktails. The best restaurant I have visited. Lots to choose from on the menu which can be viewed on their website. Would highly recommend and will be visiting again :-) from Sophie and Al...,Visited kuala lumpur for 2 days in November and this was by far my favourite bar to visit... the food is amazing and the drinks are too! The customer service is the best we’ve seen in Malaysia!
Graze Restaurant,4.527974047826087,3.0,4.700876966666667,4.8508477026315795,4.767684696296296,4.610441767068273,249,"Kuala lumpur,""""Had a business lunch here. The lady who took our order is very polite and kind. We wanted to share a salad and remarked that we loved arugula. Not only did they come out with the salad nicely spilt and plated into 2 separate plates but...",No specific mentions found.,"Kuala lumpur,It was truly a lovely dining experience :) My boyfriend brought me here in conjunction to my birthday celebration in December 2014. The service was so good and staffs were very friendly and helpful! We enjoyed our food like a king :) Wil...","Kuala lumpur,Wonderful moment. My wife so happy with the surprise birthday celebration. The Graze team did great job. They have bring the surprise birthday cake while singing birthday song. The food over here is very tasty & the prices are reasonable...","Kuala lumpur,""""This is probably one of my best rated wine dinner I’ve had so far. The Jacopo Biandi Santi wine dinner is more than perfect! Is the pure definition of finesse ! Wine selection for pairing was a class of its own, food was superb and ser..."
Greyhound Cafe,3.805162447826087,3.0,4.363189376923077,4.838799975,3.7656391933333335,3.482142857142857,56,"Stopped in for lunch, food was great and really enjoyed the iced coffee and banana shakes! Seats are really comfy and staff were lovely","Opened in March 2016, Greyhound Café KL is an interior decorator’s dream come true. The ambience is undeniable and a true reflection of the Greyhound Café concept of creating a tasteful and casual dining experience.hound Café may primarily be a Thai ...",I must say that the waiter/waitress working in Mid Valley outlet are very attentive and they’re always around whether you’re seated inside or outside(open air).The food was served fast.The drinks are really good here!I had the coconut shake.My kids a...,"A very cozy chick cafe with good vibes good food . Is my first time and food was so far so good. Black and white theme cafe with a very unique touch of figure age it's kinda cute I must say . Must try the Thai ice milk tea, yummy thumbs up! Chicken w...","We found it by accident and we will be going there again and again.  The menu is wonderful and the Desserts look delicious.  Great staff, great menu and great ambience."
Gridiron Sports Cafe & Lounge,3.0,3.0,4.5598832,3.0,4.553927757142858,4.095238095238095,21,This European style sports cafe is awesome to visit during football match. Good variety food together with happy hour promo will cheer you all day long.,No specific mentions found.,Came on a Monday night with a friend of mine and we arrived just 5 mins after the happy hour but the staff was nice enough to offer us drinks at the price (very reasonable) of happy hour! The DJ in charge was DJ Nexto and the music was absolutely ama...,No specific mentions found.,"I spent a number of afternoons here during the recent cricket world cup. Wow!They have over 20 screens, and are able to show 4 or more sports at once, which is really good. Few sports bars in KL paid the extra to subscribe for the world cup, so that ..."
Hadramawt Restaurant,4.709427831818181,3.0,3.691929483333333,3.0,3.80079024,4.0256410256410255,39,"i love arabic cuisine so much, so this restaurant is a definitely must come place to enjoy the food with all family or friends. i recommend the Mandi Lamb the most.",No specific mentions found.,Been here only 3 times...but love the food n deco. food arw v.nice! just love arabic food with lamb..esp MANDY! got dadih for free n it taste great! my children love it. my hubby n i love lamb. my parents also love this place...probably the deco n th...,No specific mentions found.,I loved this restaurant while the food quality is good. location is fantastic and the service is good.it's really near a lot of malls and perfect for arabs who looks for privacy and familiar food.the location is very good and walking distance from mu...
